{
  "schema_version": "m4cil-manifest/v1",
  "status": "PROPOSED_PENDING_MEASUREMENT",
  "profile_id": "flrh-m4cil-single-effect-incremental-reference/1",
  "owned_closure": [
    "docs/M4CIL_INTEGRATED_INCREMENTAL_SLICE.md",
    "fixtures/m4cil/cases.json",
    "scripts/check_m4cil_sensitivity.py",
    "scripts/m4cil_fixtures.py",
    "scripts/m4cil_verifier.py",
    "scripts/run_m4cil_replay.py",
    "scripts/validate_m4cil.py",
    "spec/m4cil-integration-contract.v1.json",
    "spec/m4cil-manifest.v1.json",
    "spec/schema/m4cil-fixtures.v1.schema.json",
    "spec/schema/m4cil-integration-contract.v1.schema.json",
    "spec/schema/m4cil-manifest.v1.schema.json",
    "tests/test_m4cil_candidate_gate.py",
    "tests/test_m4cil_integration.py"
  ],
  "inherited_sha256_pins": [
    {"artifact":"spec/m4c-integration-contract.v1.json","sha256":"sha256:aeb06aa24af5b06729d8f54663b46abfb8fd68a858f5b75b695a4af561679efa"},
    {"artifact":"spec/m4c-manifest.v1.json","sha256":"sha256:ab8c1fb591d53a05ed643f851151724ead3c0dab7293f213651f86e8a8122c7b"},
    {"artifact":"spec/schema/m4c-integration-contract.v1.schema.json","sha256":"sha256:0352bf564aa8720cf33be549b6bca65177f6a7555afd6287f7ae75737e6a013d"},
    {"artifact":"spec/schema/m4c-fixtures.v1.schema.json","sha256":"sha256:79a60075d291866e514a8e04846a85e65d795084fe743586ceb3e4c0c6eaa75d"},
    {"artifact":"spec/schema/m4c-manifest.v1.schema.json","sha256":"sha256:2ca72c28ff129b0f53e8f571d0ce33fd629cac23fa7897c848fabd66227d272d"},
    {"artifact":"fixtures/m4c/cases.json","sha256":"sha256:bd8f12c206c2512826bb489e9b51c31a21a8939ae1d00e25798fd47437e977fd"},
    {"artifact":"scripts/m4c_verifier.py","sha256":"sha256:c3e73aab5376a684c17a1293049b8ef07ebdf7ebd9d764bcba48c87681d4dacc"},
    {"artifact":"scripts/m4c_fixtures.py","sha256":"sha256:dbaea9aa53dd81688c45cd6fa6d701685c925e1636698d7d284ed65fc3550eee"},
    {"artifact":"scripts/run_m4c_replay.py","sha256":"sha256:045585b7bfb49d8df68a96a4c4d88896c368b97712b758e8c47451afe283547f"},
    {"artifact":"scripts/check_m4c_sensitivity.py","sha256":"sha256:42ec8b0c27e03e845137e5b62dc23940f0ad6d662627d4ea3ffe3f3990b968db"},
    {"artifact":"scripts/validate_m4c.py","sha256":"sha256:6c381b5540779aa80367bc9ca246f8d86d3ec0f3fed6725a087ff3ca7f746362"},
    {"artifact":"tests/test_m4c_integration.py","sha256":"sha256:2c0f20a1f00c940e1f0616cc641185f0eb6410cf9790a801fa26a945ddc19e57"},
    {"artifact":"tests/test_m4c_candidate_gate.py","sha256":"sha256:eafd08ed998fdad4c25e94f6201cd6e1164aa6b246150d455fd06937026fdba4"},
    {"artifact":"docs/M4C_INTEGRATED_SLICE.md","sha256":"sha256:117c2e124f72aba9b81aa628d4c9aa5afc0b043f27986ea980f0a4c1b4785b2c"},
    {"artifact":"docs/M2IL_INCREMENTAL_L.md","sha256":"sha256:b49361183eda89f311831cef3b8d4b0baec0ea45ee1c9a0e7c4ed522775369bb"},
    {"artifact":"spec/m2il-incremental-contract.v1.json","sha256":"sha256:d29b026322b49ee406837ebf9dbf64b350fcfe1e88da530f842abbff4c51aaa0"},
    {"artifact":"spec/m2il-manifest.v1.json","sha256":"sha256:44c32802c0a7e3e5c3e81570f9cf62a6fa85f40965391d8a80bb976f8af16456"},
    {"artifact":"spec/schema/m2il-incremental.v1.schema.json","sha256":"sha256:7b8be90186b2bed9716dafbf2fe6f640c87f98cd6cdd31c7086e93ec53f8be81"},
    {"artifact":"spec/schema/m2il-contract.v1.schema.json","sha256":"sha256:ee67ede19e541934b9117b95cdd4ad939fe46b99e012fcb81c3b34a9175c81d5"},
    {"artifact":"spec/schema/m2il-fixtures.v1.schema.json","sha256":"sha256:0db63fb5ed5f280e473bc292c5812cfbe87ab5875157e989e787565223cc8e45"},
    {"artifact":"spec/schema/m2il-manifest.v1.schema.json","sha256":"sha256:d1f7eaf66265370d1147bbf0b347e4badb48c82beb8f5c1d5aa8aae57ea8c24e"},
    {"artifact":"fixtures/m2il/cases.json","sha256":"sha256:fdff3d607ae349f474d24a1886c41a6e8e306c4c69699a33d5d764256c3d0a07"},
    {"artifact":"fixtures/m2il/golden/insertion-reuse.fixpoint.json","sha256":"sha256:7ac74957efac1db408b1f3d6d7e9818e92431838705026c0de5701f7d0378ae9"},
    {"artifact":"fixtures/m2il/golden/retraction-reuse.fixpoint.json","sha256":"sha256:5f6da1c91f8f5656fbfc0c626fc5cc9f537c2e68445918c68eb2e3ec66951123"},
    {"artifact":"src/flrh_logic_incremental/__init__.py","sha256":"sha256:97a6171a183ca429f894fc68ff084fd141f7f2fae3fe25cb8c2c8a0b06ee4161"},
    {"artifact":"src/flrh_logic_incremental/canonical.py","sha256":"sha256:d01c7c5abe65d8551f887f44e4815bbc5b60fcbe7b8d6b67e3869323f9d0fb39"},
    {"artifact":"src/flrh_logic_incremental/incremental.py","sha256":"sha256:996760a92e6860055d3fc81114f9428d5ca235c19d327931b685acbf305161c4"},
    {"artifact":"scripts/m2il_fixtures.py","sha256":"sha256:560a6deafa4139808390cff8db808871ef62bf16482e58d3d70489bd01b0fb9a"},
    {"artifact":"scripts/m2il_oracle.py","sha256":"sha256:75c3e947c71d9a5d19d6b822251244b41dfd6096db99d63d58a5c164d10f8c9d"},
    {"artifact":"scripts/m2il_guard.py","sha256":"sha256:41fd212776db1a11bd9174c7877065688cc1a4503b85f735b883c5a175070f9d"},
    {"artifact":"scripts/check_m2il_ambient.py","sha256":"sha256:f900d922b8ae0b73dad8e1e8fc5b67404353a1c61042fb1195fd357e424808ea"},
    {"artifact":"scripts/check_m2il_semantic_mutants.py","sha256":"sha256:35401049f0f5cad854ae695c6c5c88204879226fb0173d65e7fc187cadc03b24"},
    {"artifact":"scripts/run_m2il_replay.py","sha256":"sha256:eb5c93feec4f73dc5f6dfcd8539c93e79e96f64d2fd1052f1b9bdc1f44d4a0ca"},
    {"artifact":"scripts/validate_m2il.py","sha256":"sha256:477cd0c3dae6d195e9a71bc143dd1fb8d03a9aa6a2ba3f9f364a2f2b1e440bad"},
    {"artifact":"tests/test_m2il_incremental.py","sha256":"sha256:e46f3234060f0b18762588ae53334b6256dce13efff6ee12801ea643f1894841"},
    {"artifact":"tests/test_m2il_candidate_gate.py","sha256":"sha256:ee0bc187daee86c4fdce0a477dc115366a4671b6f348eb486eb39e74ef9b3e8c"}
  ],
  "source_subjects": {
    "m4c_mechanics_commit": "b387a0cb8ffe9acde58abcd295e7692f1d17ad54",
    "m2il_mechanics_commit": "62622b3ddccb02970ede9d336a9eec31957adeda"
  },
  "completion_boundary": "Candidate evidence only. No outer completion, total-runtime performance, persistent L storage, real destination, production, engine, comparative efficacy, or Lakatos progress claim."
}
